{
  "date": "2026-10-23",
  "checked_at": "2026-10-23T08:21:40Z",
  "manifest_version": "2026.10.23",
  "counts": {
    "status": 0,
    "new": 868,
    "period": 0
  },
  "hrefs": {
    "json": "changes/2026-10-23.json",
    "parquet": "changes/2026-10-23.parquet",
    "feeds": "feeds/index.json"
  },
  "recent": [
    {
      "date": "2026-10-23",
      "href": "changes/2026-10-23.json",
      "counts": {
        "status": 0,
        "new": 868,
        "period": 0
      }
    },
    {
      "date": "2026-10-22",
      "href": "changes/2026-10-22.json",
      "counts": {
        "status": 0,
        "new": 2,
        "period": 0
      }
    }
  ]
}
